{
  "name": "cityofmesa-everything-claude-code",
  "version": "1.5.1",
  "description": "Forked from Complete collection of battle-tested Claude Code configs from an Anthropic hackathon winner - agents, skills, hooks, and rules evolved over 10+ months of intensive daily use",
  "author": {
    "name": "City of Mesa",
    "url": "https://comdeveloper.visualstudio.com/DefaultCollection/AGENTIC-AI"
  },
  "homepage": "https://comdeveloper.visualstudio.com/DefaultCollection/AGENTIC-AI",
  "repository": "https://comdeveloper.visualstudio.com/DefaultCollection/AGENTIC-AI/_git/everything-claude-code",
  "license": "MIT",
  "keywords": [
    "claude-code",
    "agents",
    "skills",
    "hooks",
    "rules",
    "tdd",
    "code-review",
    "security",
    "workflow",
    "automation",
    "best-practices"
  ],
  "skills": ["./skills/", "./commands/"],
  "agents": [
    "./agents/architect.md",
    "./agents/build-error-resolver.md",
    "./agents/code-reviewer.md",
    "./agents/database-reviewer.md",
    "./agents/doc-updater.md",
    "./agents/e2e-runner.md",
    "./agents/go-build-resolver.md",
    "./agents/go-reviewer.md",
    "./agents/planner.md",
    "./agents/python-reviewer.md",
    "./agents/refactor-cleaner.md",
    "./agents/security-reviewer.md",
    "./agents/tdd-guide.md"
  ]
}
